CREATE TABLE PROGRAMMER (EmpNo NUMBER(5) PRIMARY KEY,
  2  ProjId CHAR(5) NOT NULL,
  3  LastName VARCHAR(30),
  4  FirstName VARCHAR(30),
  5  HireDate DATE,
  6  Language VARCHAR(15),
  7  TaskNo NUMBER(2),
  8  Privilege VARCHAR(25) NULL);

Table created.

SQL> INSERT INTO PROGRAMMER VALUES(201,'Gupta','Saurav',TO_DATE('1/1/1995','MM/DD/YYYY'),'NPR','VB',52,'Secret');
INSERT INTO PROGRAMMER VALUES(201,'Gupta','Saurav',TO_DATE('1/1/1995','MM/DD/YYYY'),'NPR','VB',52,'Secret')
                                                                                    *
ERROR at line 1:
ORA-01858: a non-numeric character was found where a numeric was expected


SQL> INSERT INTO PROGRAMMER VALUES(201,'NPR','Gupta','Saurav',TO_DATE('1/1/1995','MM/DD/YYYY'),'VB',52,'Secret');

1 row created.

SQL> INSERT INTO PROGRAMMER VALUES(390,'KCW','Ghosh','Pinky',TO_DATE('1/5/1993','MM/DD/YYYY'),'Java',11,'Top Secret');

1 row created.

SQL> INSERT INTO PROGRAMMER VALUES(789,'RNC','Agrawal','Praveen',TO_DATE('8/31/1998','MM/DD/YYYY'),'VB',11,'Secret');

1 row created.

SQL> INSERT INTO PROGRAMMER VALUES(134,'TIPPS','Chaudhary','Supriyo',TO_DATE('7/15/1995','MM/DD/YYYY'),'C++',52,'Secret');

1 row created.

SQL> SELECT * FROM PROGRAMMER;

     EMPNO PROJI LASTNAME                       FIRSTNAME
---------- ----- ------------------------------ ------------------------------
HIREDATE  LANGUAGE            TASKNO PRIVILEGE
--------- --------------- ---------- -------------------------
       201 NPR   Gupta                          Saurav
01-JAN-95 VB                      52 Secret

       390 KCW   Ghosh                          Pinky
05-JAN-93 Java                    11 Top Secret

       789 RNC   Agrawal                        Praveen
31-AUG-98 VB                      11 Secret


     EMPNO PROJI LASTNAME                       FIRSTNAME
---------- ----- ------------------------------ ------------------------------
HIREDATE  LANGUAGE            TASKNO PRIVILEGE
--------- --------------- ---------- -------------------------
       134 TIPPS Chaudhary                      Supriyo
15-JUL-95 C++                     52 Secret


SQL> CREATE TABLE WEATHER (CITY VARCHAR(15),
  2  STATE VARCHAR(20),
  3  HIGH NUMBER(3),
  4  LOW NUMBER (3),
  5  EX NUMBER(1));

Table created.

SQL> ALTER TABLE WEATHER DROP  COLUMN EX;

Table altered.

SQL> DESC WEATHER;
 Name                                      Null?    Type
 ----------------------------------------- -------- ----------------------------
 CITY                                               VARCHAR2(15)
 STATE                                              VARCHAR2(20)
 HIGH                                               NUMBER(3)
 LOW                                                NUMBER(3)

SQL> INSERT INTO WEATHER VALUES('Calcutta', 'West Bengal',105,90);

1 row created.

SQL> INSERT INTO WEATHER VALUES('Trivandrum','Kerela',101,92);

1 row created.

SQL> INSERT INTO WEATHER VALUES('Mumbai','Maharashtra',88,69);

1 row created.

SQL> INSERT INTO WEATHER VALUES('Banglore','Karnataka',77,60);

1 row created.

SQL> alter table weather modify(state varchar(20) null);
alter table weather modify(state varchar(20) null)
                           *
ERROR at line 1:
ORA-01451: column to be modified to NULL cannot be modified to NULL


SQL> alter table weather modify constarints(state null);
alter table weather modify constarints(state null)
                                      *
ERROR at line 1:
ORA-00902: invalid datatype


SQL> alter table weather modify constarints(state varchar(20) null);
alter table weather modify constarints(state varchar(20) null)
                                      *
ERROR at line 1:
ORA-00902: invalid datatype


SQL> desc weather;
 Name                                      Null?    Type
 ----------------------------------------- -------- ----------------------------
 CITY                                               VARCHAR2(15)
 STATE                                              VARCHAR2(20)
 HIGH                                               NUMBER(3)
 LOW                                                NUMBER(3)

SQL> select * from weather;

CITY            STATE                      HIGH        LOW
--------------- -------------------- ---------- ----------
Calcutta        West Bengal                 105         90
Trivandrum      Kerela                      101         92
Mumbai          Maharashtra                  88         69
Banglore        Karnataka                    77         60

SQL> CREATE TABLE BOOKS (BookId NUMBER(4) PRIMARY KEY,
  2  Title CHAR(4),
  3  TopicId CHAR(6),
  4  PublisherName VARCHAR(30),
  5  PlaceOfPublication VARCHAR(30),
  6  Price NUMBER(3),
  7  PurchaseDate DATE,
  8  ShelfNo CHAR(3));

Table created.

SQL> INSERT INTO BOOKS VALUES(8293,'DBMS','DB1','Prentice Hall','Mumbai',255, TO_DATE('1/1/1995','MM/DD/YYYY'),'S11');

1 row created.

SQL> INSERT INTO BOOKS VALUES(5645,'DBMS','DB1','Pearson Education','Mumbai',655, TO_DATE('1/5/1993','MM/DD/YYYY'),'S12');

1 row created.

SQL> INSERT INTO BOOKS VALUES(6565,'C','C1','TMH','Mumbai',840, TO_DATE('8/31/1998','MM/DD/YYYY'),'S66');

1 row created.

SQL> INSERT INTO BOOKS VALUES(6567,'C++','Cplus1','ABC Publisher','Delhi',300, TO_DATE('7/15/1995','MM/DD/YYYY'),'S77');

1 row created.

SQL> select* from books;

    BOOKID TITL TOPICI PUBLISHERNAME
---------- ---- ------ ------------------------------
PLACEOFPUBLICATION                  PRICE PURCHASED SHE
------------------------------ ---------- --------- ---
      8293 DBMS DB1    Prentice Hall
Mumbai                                255 01-JAN-95 S11

      5645 DBMS DB1    Pearson Education
Mumbai                                655 05-JAN-93 S12

      6565 C    C1     TMH
Mumbai                                840 31-AUG-98 S66


    BOOKID TITL TOPICI PUBLISHERNAME
---------- ---- ------ ------------------------------
PLACEOFPUBLICATION                  PRICE PURCHASED SHE
------------------------------ ---------- --------- ---
      6567 C++  Cplus1 ABC Publisher
Delhi                                 300 15-JUL-95 S77


SQL> update PROGRAMMER SET ProjId='NTTS', Language='C++', where EmpNo=201;
update PROGRAMMER SET ProjId='NTTS', Language='C++', where EmpNo=201
                                                     *
ERROR at line 1:
ORA-01747: invalid user.table.column, table.column, or column specification


SQL> update PROGRAMMER SET ProjId='NTTS' where EmpNo=201;

1 row updated.

SQL> update PROGRAMMER SET Language='C++' where EmpNo=2-10;

0 rows updated.

SQL> update PROGRAMMER SET Language='C++' where EmpNo=201;

1 row updated.

SQL> update BOOKS SET ShelfNo='S10' where Title='DBMS';

2 rows updated.

SQL> ALTER TABLE WEATHER ADD(ClimateType CHAR(6) CHECK(ClimateType in ('Rainy','Cloudy','Sunny','Snow');
ALTER TABLE WEATHER ADD(ClimateType CHAR(6) CHECK(ClimateType in ('Rainy','Cloudy','Sunny','Snow')
                                                                                                 *
ERROR at line 1:
ORA-00907: missing right parenthesis


SQL> ALTER TABLE WEATHER ADD(ClimateType CHAR(6) CHECK(ClimateType in ('Rainy','Cloudy','Sunny','Snow'));
ALTER TABLE WEATHER ADD(ClimateType CHAR(6) CHECK(ClimateType in ('Rainy','Cloudy','Sunny','Snow'))
                                                                                                  *
ERROR at line 1:
ORA-00907: missing right parenthesis


SQL> ALTER TABLE WEATHER ADD (ClimateType CHAR(6) CHECK(ClimateType in ('Rainy','Cloudy','Sunny','Snow')));

Table altered.

SQL> create table supplier (supplierid number(2) primary key,
  2  sname varchar(15) not null,
  3  scity varchar(15),
  4  sphone number(10),
  5  email varchar(30));

Table created.

SQL> insert into supplier values (1, 'Dilip', 'Chennai', 8999900000, 'dilip@abc.co.in');

1 row created.

SQL> insert into supplier values (2, 'Tarun', 'Madhurai', 899911111, 'tarun@yz.com');

1 row created.

SQL> insert into supplier values (3, 'Naresh', 'Coimbatore', 899922222, 'g.naresh@xyzl.com');

1 row created.
SQL> insert into supplier values (4, 'Ganesan', 'Trichy', 899933333, 'Ganesan_83@ijk.com');

1 row created.

SQL> create table customer (custid number(4) primary key,
  2  fname char(30),
  3  lname char(30),
  4  address varchar(50),
  5  phoneno number(10) not null,
  6  city varchar(20),
  7  country char(20),
  8  datefirstpurchased date,
  9  supplierid number(2),
 10  foreign key (supplierid) references supplier(supplierid));

Table created.

SQL> insert into customer values(2001, 'Gopi', 'Govindraj','241, I floor, Kamaraj street, Madippakkam', 9444124590, 'Chennai', 'India', '25 Mar 05', 4);

1 row created.

SQL> insert into customer values(1201, 'Dilip', 'Kishore','43, II Avenue, Anna Nagar', 9997234534, 'Bangalore', 'India', '20 Aug 04', 2);

1 row created.

insert into customer values(1001, 'Das', 'Jeyaseelan','119, park Avenue, II street', 9841093428, 'Coimbatore', 'India', '10 Jan 04', 3);

1 row created.

SQL> create table items (itemid number(2) primary key,
  2  itemname varchar(35) not null,
  3  supplierid number(2),
  4  minqty number(5) not null,
  5  maxqty number(5) not null,
  6  price number(5,2),
  7  foreign key (supplierid) references supplier (supplierid));

Table created.

SQL> insert into items values (20, 'Pears Soap', 4, 7, 20, 30);

1 row created.

SQL> insert into items values (21, 'V. V. D. Coconut oil 200 ml', 2, 8, 15, 79);

1 row created.

SQL> insert into items values (22, 'Ponds Powder 400g', 3, 6, 25, 106);

1 row created.

SQL> insert into items values (25, 'Mysore sandal soap', 4, 7, 25, 25);

1 row created.

SQL> insert into items values (24, 'Reynolds pen- blue', 3, 10, 30, 16);

1 row created.

SQL> insert into items values (23, 'Reynolds pen- black', 3, 10, 30, 15);

1 row created.

SQL> select * from items;

    ITEMID ITEMNAME                            SUPPLIERID     MINQTY     MAXQTY
---------- ----------------------------------- ---------- ---------- ----------
     PRICE
----------
        20 Pears Soap                                   4          7         20
        30

        21 V. V. D. Coconut oil 200 ml                  2          8         15
        79

        22 Ponds Powder 400g                            3          6         25
       106


    ITEMID ITEMNAME                            SUPPLIERID     MINQTY     MAXQTY
---------- ----------------------------------- ---------- ---------- ----------
     PRICE
----------
        25 Mysore sandal soap                           4          7         25
        25

        24 Reynolds pen- blue                           3         10         30
        16

        23 Reynolds pen- black                          3         10         30
        15


6 rows selected.

SQL> create table orders (orderid number(2) primary key,
  2  orderdate date,
  3  custid number(4),
  4  quantity number(5) check(quantity>0),
  5  itemid number(2),
  6  foreign key (itemid) references items(itemid));

Table created.

SQL> insert into orders values (1,'12 jan 04', 1001, 30, 25);

1 row created.

SQL> insert into orders values (2,'6 may 05', 1202, 38, 24);

1 row created.

SQL> insert into orders values (3,'16 dec 06', 1220, 10, 22);

1 row created.

SQL> insert into orders values (4,'21 may 04', 1233, 12, 21);

1 row created.

SQL> select * from customer where city='Chennai';

    CUSTID FNAME                          LNAME
---------- ------------------------------ ------------------------------
ADDRESS                                               PHONENO
-------------------------------------------------- ----------
CITY                 COUNTRY              DATEFIRST SUPPLIERID
-------------------- -------------------- --------- ----------
      2001 Gopi                           Govindraj
241, I floor, Kamaraj street, Madippakkam          9444124590
Chennai              India                25-MAR-05          4


SQL> select * from customer where supplierid=2
  2  ;

    CUSTID FNAME                          LNAME
---------- ------------------------------ ------------------------------
ADDRESS                                               PHONENO
-------------------------------------------------- ----------
CITY                 COUNTRY              DATEFIRST SUPPLIERID
-------------------- -------------------- --------- ----------
      1201 Dilip                          Kishore
43, II Avenue, Anna Nagar                          9997234534
Bangalore            India                20-AUG-04          2


SQL> select custid, fname, lname from customer where datefirstpurchased>'1 jan 05';

    CUSTID FNAME                          LNAME
---------- ------------------------------ ------------------------------
      2001 Gopi                           Govindraj

SQL> select * from customer where lname not like '%e%';

    CUSTID FNAME                          LNAME
---------- ------------------------------ ------------------------------
ADDRESS                                               PHONENO
-------------------------------------------------- ----------
CITY                 COUNTRY              DATEFIRST SUPPLIERID
-------------------- -------------------- --------- ----------
      2001 Gopi                           Govindraj
241, I floor, Kamaraj street, Madippakkam          9444124590
Chennai              India                25-MAR-05          4


SQL> select * from supplier where scity='Coimbatore';

SUPPLIERID SNAME           SCITY               SPHONE
---------- --------------- --------------- ----------
EMAIL
------------------------------
         3 Naresh          Coimbatore       899922222
g.naresh@xyzl.com


SQL> select * from supplier where sname like 'G%';

SUPPLIERID SNAME           SCITY               SPHONE
---------- --------------- --------------- ----------
EMAIL
------------------------------
         4 Ganesan         Trichy           899933333
Ganesan_83@ijk.com


SQL> select * from customer where datefirstpurchased>='1 jan 06' order by datefirstpurchased desc;

no rows selected

SQL> select * from orders where quantity<35;

   ORDERID ORDERDATE     CUSTID   QUANTITY     ITEMID
---------- --------- ---------- ---------- ----------
         1 12-JAN-04       1001         30         25
         3 16-DEC-06       1220         10         22
         4 21-MAY-04       1233         12         21

SQL> select * from items where supplierid=4;

    ITEMID ITEMNAME                            SUPPLIERID     MINQTY     MAXQTY
---------- ----------------------------------- ---------- ---------- ----------
     PRICE
----------
        20 Pears Soap                                   4          7         20
        30

        25 Mysore sandal soap                           4          7         25
        25


SQL> select * from items where supplierid=3 and minqty>7 order by itemid;

    ITEMID ITEMNAME                            SUPPLIERID     MINQTY     MAXQTY
---------- ----------------------------------- ---------- ---------- ----------
     PRICE
----------
        23 Reynolds pen- black                          3         10         30
        15

        24 Reynolds pen- blue                           3         10         30
        16


SQL> select s.sname, s.scity, c.fname, c.phoneno from supplier s right outer join customer c on s.supplierid=c.supplierid;

SNAME           SCITY           FNAME                             PHONENO
--------------- --------------- ------------------------------ ----------
Ganesan         Trichy          Gopi                           9444124590
Tarun           Madhurai        Dilip                          9997234534
Naresh          Coimbatore      Das                            9841093428

SQL> select s.sname, s.scity, c.fname, c.phoneno from supplier s, customer c s.supplierid=c.supplierid;
select s.sname, s.scity, c.fname, c.phoneno from supplier s, customer c s.supplierid=c.supplierid
                                                                        *
ERROR at line 1:
ORA-00933: SQL command not properly ended


SQL> select s.sname, s.scity, c.fname, c.phoneno from supplier s, customer c where s.supplierid=c.supplierid;

SNAME           SCITY           FNAME                             PHONENO
--------------- --------------- ------------------------------ ----------
Ganesan         Trichy          Gopi                           9444124590
Tarun           Madhurai        Dilip                          9997234534
Naresh          Coimbatore      Das                            9841093428

SQL> select s.sname, s.scity, c.fname, c.phoneno from supplier s left outer join customer c on s.supplierid=c.supplierid;

SNAME           SCITY           FNAME                             PHONENO
--------------- --------------- ------------------------------ ----------
Ganesan         Trichy          Gopi                           9444124590
Tarun           Madhurai        Dilip                          9997234534
Naresh          Coimbatore      Das                            9841093428

SQL> create sequence regno_seq start with 105
  2  increment by 1
  3  maxvalue 110;
create sequence regno_seq start with 105
                *
ERROR at line 1:
ORA-00955: name is already used by an existing object


SQL> select * from student;

   REGD_NO FNAME                          MNAME           LNAME
---------- ------------------------------ --------------- --------------------
MAILID                          MOBILE_NO
------------------------------ ----------
       117 Ankita                                         Panda
anki@gmail.com

       115 Aishwarya                                      Pradhan
aish@gmail.com

       116 Ankita                                         Panda
anki88@gmail.com


   REGD_NO FNAME                          MNAME           LNAME
---------- ------------------------------ --------------- --------------------
MAILID                          MOBILE_NO
------------------------------ ----------
       105 a                              k               p
akp@gmail.com                         123

       106 a                              k               p
pka@gmail.com                         123

       107 a                              k               p
kap@gmail.com                         123


   REGD_NO FNAME                          MNAME           LNAME
---------- ------------------------------ --------------- --------------------
MAILID                          MOBILE_NO
------------------------------ ----------
       108 a                              k               p
iop@gmail.com                         123


7 rows selected.
